{
  "$schema": "../../../../../schemas/v3/generic-definitions/ui-fragment.v3.schema.json",
  "kind": "ui-fragment",
  "name": "messageArea",
  "purpose": "画面上部に validation / system エラーメッセージを集中表示する共通領域",
  "responsibilities": [
    "validation エラー一覧をリスト表示する",
    "system エラー (一般メッセージ) を表示する",
    "成功通知メッセージを一定時間表示後にフェードアウトする",
    "複数 instance (error / info) を画面内で同居可能とする"
  ],
  "targets": ["frontend"],
  "relations": [
    {
      "kind": "appliesTo",
      "ref": "generic-definitions/ui-behavior/dirtyCheck",
      "description": "dirtyCheck の確認結果メッセージ表示先として利用される。"
    }
  ],
  "constraints": [
    "DOM 上は ul / div の単純構造で、スクリーンリーダーに role=alert を提供する",
    "メッセージは i18n key を受け取り、自身で文言展開しない (i18n は呼び出し側)"
  ],
  "mappingHints": {
    "frontend.thymeleaf": {
      "fragmentName": "messageArea",
      "templatePath": "fragments/message-area.html"
    },
    "frontend.next": {
      "componentName": "MessageArea",
      "package": "components/common"
    }
  }
}
